{
  "blocked": [],
  "friends": [
    {
      "id": "a4c67aeb-2f0e-44f1-8d12-f955964bc359",
      "level": 1,
      "streak": 0,
      "country": null,
      "trophies": 0,
      "username": "qana_fit",
      "avatarPreset": null
    },
    {
      "id": "6cdf6ea2-0d7d-4e4e-b748-6dcfd1ccb152",
      "level": 1,
      "streak": 0,
      "country": null,
      "trophies": 0,
      "username": "qeve.pushes",
      "avatarPreset": null
    }
  ],
  "incoming": [],
  "outgoing": []
}
